[
  {"id": "AC-001", "kind": "scenario", "milestone": "M1", "increment": 0, "slice": "slice-01", "title": "A user completes the first end-to-end journey on synthetic data",
   "cwd": ".", "check": "scripts/dev/must-run.sh ./e2e TestAC001_FirstJourney",
   "passes": false, "evidence": null, "human_act": null, "tasks": []},
  {"id": "C-1-3", "kind": "claim", "milestone": "M1", "increment": null, "slice": null, "title": "Target users already pay for a manual version of this work",
   "cwd": ".", "check": "sliceworks check claim rounds/1-market C-1-3",
   "passes": false, "evidence": null, "human_act": null, "tasks": []},
  {"id": "G-M1-LEGAL-1", "kind": "gate", "milestone": "M1", "increment": null, "slice": null, "title": "Consent text approved by counsel",
   "cwd": ".", "check": "sliceworks check gate NH-03",
   "passes": false, "evidence": null, "human_act": "NH-03", "tasks": []},
  {"id": "P-PROD-HEALTH", "kind": "probe", "milestone": "M1", "increment": null, "slice": null, "title": "Production health endpoint answers",
   "cwd": ".", "check": "curl -fsS https://example.invalid/healthz",
   "passes": false, "evidence": null, "human_act": null, "tasks": []}
]
